### ISSUE TITLE
name resolution stops working if ipv6 connectivity brought down

### ISSUE THREAD

**Issue by jackivanov** [DNSCrypt/dnscrypt-proxy#668]
**Info**

```
# dnscrypt-proxy --version
2.0.19
```

```
# uname -a
Linux ubuntu-s-1vcpu-1gb-lon1-01 4.4.0-140-generic #166-Ubuntu SMP Wed Nov 14 20:09:47 UTC 2018 x86_64 x86_64 x86_64 GNU/Linux
```

```
server_names = ['cloudflare', 'cloudflare-ipv6']
listen_addresses  = ['127.0.0.1:53']
max_clients = 250
ipv4_servers = true
ipv6_servers = true
dnscrypt_servers = true
doh_servers = true
require_dnssec = true
require_nolog = true
require_nofilter = true
force_tcp = false
timeout = 2500
keepalive = 30
lb_strategy = 'p2'
log_level = 2
use_syslog = true
cert_refresh_delay = 240
dnscrypt_ephemeral_keys = true
tls_disable_session_tickets = true
fallback_resolver = '8.8.8.8:53'
ignore_system_dns = true
log_files_max_size = 10
log_files_max_age = 7
log_files_max_backups = 1
block_ipv6 = false
cache = true
cache_size = 512
cache_min_ttl = 600
cache_max_ttl = 86400
cache_neg_min_ttl = 60
cache_neg_max_ttl = 600
[query_log]
  format = 'tsv'
[nx_log]
  format = 'tsv'
[blacklist]
[ip_blacklist]
  blacklist_file = 'ip-blacklist.txt'
[whitelist]
[schedules]
[sources]
  [sources.'public-resolvers']
  urls = ['https://raw.githubusercontent.com/DNSCrypt/dnscrypt-resolvers/master/v2/public-resolvers.md', 'https://download.dnscrypt.info/resolvers-list/v2/public-resolvers.md']
  cache_file = '/tmp/public-resolvers.md'
  minisign_key = 'RWQf6LRCGA9i53mlYecO4IzT51TGPpvWucNSCh1CBM0QTaLn73Y7GFO3'
  refresh_delay = 72
  prefix = ''
[static]
```

**Steps to reproduce**
1. Configure dnscrypt-proxy as above
2. ensure it's working `dig google.com @127.0.0.1 -p 53`
3. delete the default ipv6 route `ip -6 route del default`
4. dnscrypt-proxy stopped responding
```
# dig apple.com @127.0.0.1 +time=3

; <<>> DiG 9.10.3-P4-Ubuntu <<>> apple.com @127.0.0.1 +time=3
;; global options: +cmd
;; connection timed out; no servers could be reached
```

logs: (nothing suspicious)
```
Dec 18 11:27:04 ubuntu-s-1vcpu-1gb-lon1-01 dnscrypt-proxy[2809]: Source [/tmp/public-resolvers.md] loaded
Dec 18 11:27:04 ubuntu-s-1vcpu-1gb-lon1-01 dnscrypt-proxy[2809]: dnscrypt-proxy 2.0.19
Dec 18 11:27:04 ubuntu-s-1vcpu-1gb-lon1-01 dnscrypt-proxy[2809]: Loading the set of IP blocking rules from [ip-blacklist.txt]
Dec 18 11:27:04 ubuntu-s-1vcpu-1gb-lon1-01 dnscrypt-proxy[2809]: Now listening to 127.0.0.1:53 [UDP]
Dec 18 11:27:04 ubuntu-s-1vcpu-1gb-lon1-01 dnscrypt-proxy[2809]: Now listening to 127.0.0.1:53 [TCP]
Dec 18 11:27:04 ubuntu-s-1vcpu-1gb-lon1-01 dnscrypt-proxy[2809]: Wiring systemd TCP socket #0, dnscrypt-proxy.socket, 127.0.2.1:53
Dec 18 11:27:04 ubuntu-s-1vcpu-1gb-lon1-01 dnscrypt-proxy[2809]: Wiring systemd UDP socket #1, dnscrypt-proxy.socket, 127.0.2.1:53
Dec 18 11:27:04 ubuntu-s-1vcpu-1gb-lon1-01 dnscrypt-proxy[2809]: [cloudflare] OK (DoH) - rtt: 3ms
Dec 18 11:27:04 ubuntu-s-1vcpu-1gb-lon1-01 dnscrypt-proxy[2809]: [cloudflare-ipv6] OK (DoH) - rtt: 3ms
Dec 18 11:27:04 ubuntu-s-1vcpu-1gb-lon1-01 dnscrypt-proxy[2809]: Server with the lowest initial latency: cloudflare (rtt: 3ms)
Dec 18 11:27:04 ubuntu-s-1vcpu-1gb-lon1-01 dnscrypt-proxy[2809]: dnscrypt-proxy is ready - live servers: 2
```

tcpdump with not responses from the daemon:
```
11:52:39.519728 IP 127.0.0.1.55567 > 127.0.0.1.53: 31699+ [1au] A? apple.com. (38)
11:52:42.519704 IP 127.0.0.1.55567 > 127.0.0.1.53: 31699+ [1au] A? apple.com. (38)
11:52:45.519837 IP 127.0.0.1.55567 > 127.0.0.1.53: 31699+ [1au] A? apple.com. (38)
```

- returning back the default ipv6 route fixes the issue
- restart dnscrypt-proxy fixes the issue

**Expected behaviour:**
If ipv6 connectivity lost, dnscrypt-proxy should switch to ipv4 mode only, transparently for the end users . The same should happen with ipv4 being brought down, if ipv6 available.

**Comment by jedisct1** [comment]
```
Dec 18 11:27:04 ubuntu-s-1vcpu-1gb-lon1-01 dnscrypt-proxy[2809]: Wiring systemd TCP socket #0, dnscrypt-proxy.socket, 127.0.2.1:53
Dec 18 11:27:04 ubuntu-s-1vcpu-1gb-lon1-01 dnscrypt-proxy[2809]: Wiring systemd UDP socket #1, dnscrypt-proxy.socket, 127.0.2.1:53
```

You are using systemd sockets. dnscrypt-proxy doesn't manage these sockets.

Please try without systemd sockets.

**Comment by jackivanov** [comment]
Nothing changed

```
Dec 18 16:03:40 ubuntu-s-1vcpu-1gb-lon1-01 systemd[1]: Stopping DNSCrypt-proxy client...
Dec 18 16:03:40 ubuntu-s-1vcpu-1gb-lon1-01 systemd[1]: Stopped DNSCrypt-proxy client.
Dec 18 16:03:40 ubuntu-s-1vcpu-1gb-lon1-01 systemd[1]: Started DNSCrypt-proxy client.
Dec 18 16:03:40 ubuntu-s-1vcpu-1gb-lon1-01 dnscrypt-proxy[6274]: Source [/tmp/public-resolvers.md] loaded
Dec 18 16:03:40 ubuntu-s-1vcpu-1gb-lon1-01 dnscrypt-proxy[6274]: dnscrypt-proxy 2.0.19
Dec 18 16:03:40 ubuntu-s-1vcpu-1gb-lon1-01 dnscrypt-proxy[6274]: Loading the set of IP blocking rules from [ip-blacklist.txt]
Dec 18 16:03:40 ubuntu-s-1vcpu-1gb-lon1-01 dnscrypt-proxy[6274]: Now listening to 127.0.0.1:53 [UDP]
Dec 18 16:03:40 ubuntu-s-1vcpu-1gb-lon1-01 dnscrypt-proxy[6274]: Now listening to 127.0.0.1:53 [TCP]
Dec 18 16:03:41 ubuntu-s-1vcpu-1gb-lon1-01 dnscrypt-proxy[6274]: [cloudflare] TLS version: 303 - Protocol: h2 - Cipher suite: 49195
Dec 18 16:03:41 ubuntu-s-1vcpu-1gb-lon1-01 dnscrypt-proxy[6274]: [cloudflare] OK (DoH) - rtt: 4ms
Dec 18 16:03:41 ubuntu-s-1vcpu-1gb-lon1-01 dnscrypt-proxy[6274]: [cloudflare-ipv6] TLS version: 303 - Protocol: h2 - Cipher suite: 49195
Dec 18 16:03:41 ubuntu-s-1vcpu-1gb-lon1-01 dnscrypt-proxy[6274]: [cloudflare-ipv6] OK (DoH) - rtt: 3ms
Dec 18 16:03:41 ubuntu-s-1vcpu-1gb-lon1-01 dnscrypt-proxy[6274]: Server with the lowest initial latency: cloudflare-ipv6 (rtt: 3ms)
Dec 18 16:03:41 ubuntu-s-1vcpu-1gb-lon1-01 dnscrypt-proxy[6274]: dnscrypt-proxy is ready - live servers: 2
```

```
root@ubuntu-s-1vcpu-1gb-lon1-01:~# dig google.com @127.0.0.1 +time=3

; <<>> DiG 9.10.3-P4-Ubuntu <<>> google.com @127.0.0.1 +time=3
;; global options: +cmd
;; Got answer:
;; ->>HEADER<<- opcode: QUERY, status: NOERROR, id: 24223
;; flags: qr rd ra; QUERY: 1, ANSWER: 1, AUTHORITY: 0, ADDITIONAL: 1

;; OPT PSEUDOSECTION:
; EDNS: version: 0, flags:; udp: 1452
;; QUESTION SECTION:
;google.com.			IN	A

;; ANSWER SECTION:
google.com.		599	IN	A	216.58.204.14

;; Query time: 34 msec
;; SERVER: 127.0.0.1#53(127.0.0.1)
;; WHEN: Tue Dec 18 16:04:14 UTC 2018
;; MSG SIZE  rcvd: 65

root@ubuntu-s-1vcpu-1gb-lon1-01:~# ip -6 route
2a03:b0c0:1:d0::/64 dev eth0  proto kernel  metric 256  pref medium
fe80::/64 dev eth0  proto kernel  metric 256  pref medium
default via 2a03:b0c0:1:d0::1 dev eth0  metric 1024  pref medium

root@ubuntu-s-1vcpu-1gb-lon1-01:~# ip -6 route del default

root@ubuntu-s-1vcpu-1gb-lon1-01:~# dig apple.com @127.0.0.1 +time=3
; <<>> DiG 9.10.3-P4-Ubuntu <<>> apple.com @127.0.0.1 +time=3
;; global options: +cmd
;; connection timed out; no servers could be reached
```

**Comment by jedisct1** [comment]
Can you replicate this using DNSCrypt instead of DoH?

**Comment by jackivanov** [comment]
@jedisct1 DNSCrypt seems work if I disable ipv6, where is the problem might be?

**Comment by jedisct1** [comment]
Since you enabled Cloudflare-IPv6, when the route is deleted, I don't think Linux brings down established connections, so apps don't know.

You'll have to wait for a timeout and a few failed DNS resolutions before the proxy marks the IPv6 resolver as dead.

Using UDP may help to recover faster from this.
