### ISSUE TITLE
It seems polling.

### ISSUE THREAD

**Issue by yutayu** [DNSCrypt/dnscrypt-proxy#1152]
## Subject

* [ ] I'd like to contribute to the project (code, documentation, website, advocacy, integration, ...)
* [ ] I want to run my own DNSCrypt and/or DoH server
* [ ] I'd like to have my existing server added to a public list of encrypted DNS servers
* [ ] I'd like to announce a new application/website/article related to the project
* [x] I have questions about the DNSCrypt or Anonymized DNSCrypt protocols
* [ ] I am a MacOS developer and I'd like to contribute a GUI for dnscrypt-proxy
* [ ] I am an Android developer and I'd like to contribute an Android app
* [ ] I am a technical writer and I'd like to help write an IETF Internet Draft for the DNSCrypt protocol
* [ ] Other

## Description

pi@raspberrypi:~ $ sudo tcpdump dst 192.168.0.4 | grep blah
tcpdump: verbose output suppressed, use -v or -vv for full protocol decode
listening on eth0, link-type EN10MB (Ethernet), capture size 262144 bytes
07:29:13.416207 IP jp1.blahdns.com.8443 > 192.168.0.4.38516: UDP, length 384
07:29:13.470343 IP jp1.blahdns.com.8443 > 192.168.0.4.37525: UDP, length 192
07:29:13.822795 IP jp1.blahdns.com.8443 > 192.168.0.4.47386: UDP, length 256
07:29:14.117845 IP de1.blahdns.com.8443 > 192.168.0.4.53718: UDP, length 320
07:29:14.990535 IP jp1.blahdns.com.8443 > 192.168.0.4.36159: UDP, length 192
07:29:15.051437 IP jp1.blahdns.com.8443 > 192.168.0.4.40418: UDP, length 405
07:29:15.426366 IP jp1.blahdns.com.8443 > 192.168.0.4.51709: UDP, length 320
07:29:25.750983 IP de1.blahdns.com.8443 > 192.168.0.4.47371: UDP, length 256
07:29:26.076147 IP jp1.blahdns.com.8443 > 192.168.0.4.34901: UDP, length 192
07:29:26.897332 IP jp1.blahdns.com.8443 > 192.168.0.4.37056: UDP, length 256
07:29:29.089606 IP de1.blahdns.com.8443 > 192.168.0.4.34978: UDP, length 320
07:29:29.392658 IP de1.blahdns.com.8443 > 192.168.0.4.57890: UDP, length 128
07:29:31.622197 IP jp1.blahdns.com.8443 > 192.168.0.4.58671: UDP, length 384
07:29:34.547128 IP de1.blahdns.com.8443 > 192.168.0.4.47641: UDP, length 359
07:29:34.849366 IP de1.blahdns.com.8443 > 192.168.0.4.52773: UDP, length 192
07:29:37.042891 IP jp1.blahdns.com.8443 > 192.168.0.4.34306: UDP, length 384
07:29:39.197723 IP jp1.blahdns.com.8443 > 192.168.0.4.49977: UDP, length 425
07:29:42.104592 IP jp1.blahdns.com.8443 > 192.168.0.4.59487: UDP, length 425
07:29:44.102701 IP de1.blahdns.com.8443 > 192.168.0.4.41347: UDP, length 320
07:29:44.418490 IP de1.blahdns.com.8443 > 192.168.0.4.52066: UDP, length 360
07:29:44.607216 IP jp1.blahdns.com.8443 > 192.168.0.4.48703: UDP, length 320
07:29:45.310378 IP jp1.blahdns.com.8443 > 192.168.0.4.46830: UDP, length 256
07:29:45.908834 IP jp1.blahdns.com.8443 > 192.168.0.4.38032: UDP, length 256
07:29:48.027407 IP jp1.blahdns.com.8443 > 192.168.0.4.51811: UDP, length 256
07:29:48.546016 IP jp1.blahdns.com.8443 > 192.168.0.4.37412: UDP, length 256

This is usual?

**Comment by jedisct1** [comment]
Without the `-n` option, the `tcpdump` command tries to resolve every IP it stumbles upon.

So, most of the queries you are seeing are likely to have been sent by `tcpdump` itself.

If you are using the `tcpdump` command to inspect DNS traffic, use the `-n` option.

**Comment by yutayu** [comment]
Much thanks @jedisct1 .
