### ISSUE TITLE
dnscrypt-proxy don't encrypt urls anymore but dns is working - please help

### ISSUE THREAD

**Issue by ghost** [DNSCrypt/dnscrypt-proxy#1503]
Hi!

dnscrypt-proxy don't encrypt urls anymore but dns is working.

Can you help PLEASE? Sorry for the long text.

Thanks in advance!

I did:
**sudo tcpdump -i eth0 dst host 192.168.171.40**

**See here**:
17:24:22.615279 IP 65-62-15-51.instances.scw.cloud.443 > test.26361: UDP, length 176
17:24:23.521906 IP server-13-227-209-53.ams54.r.cloudfront.net.https > test.30522: Flags [P.], seq 2229635566:2229635605, ack 3874011521, win 306, length 39
17:24:23.522267 IP server-13-227-209-53.ams54.r.cloudfront.net.https > test.30522: Flags [P.], seq 39:63, ack 1, win 306, length 24
17:24:23.523142 IP server-13-227-209-53.ams54.r.cloudfront.net.https > test.30522: Flags [F.], seq 63, ack
and so on...

The urls are not encrypted.

When they are with dnscrypt encrypted, I would not see the domains/urls above, right or?

I visit "**www.dnsleaktest.com**"

The site shows me that my selected dnscrypt servers I selected in the config file are available.

I did:
**sudo lsof -nP -iTCP -sTCP:LISTEN**

Result:
> dnscrypt  636 dnscrypt   10u  IPv4  26215      0t0  TCP 127.0.0.1:5300 (LISTEN)
> dnscrypt   636 dnscrypt   13u  IPv4  26215      0t0  TCP 127.0.0.1:5300 (LISTEN)
> pihole-FT  816   pihole    5u  IPv4  25150      0t0  TCP *:53 (LISTEN)
> pihole-FT  816   pihole   10u  IPv4  25157      0t0  TCP 127.0.0.1:4711 (LISTEN)
> lighttpd  1841 www-data    4u  IPv4  27576      0t0  TCP *:80 (LISTEN)
> lighttpd  1841 www-data    5u  IPv4  27577      0t0  TCP 192.168.171.40:443 (LISTEN)

pihole is using: **pihole-FT:  TCP *:53 (LISTEN)**

but why is UDP port 53 not there :-/

I did:
**sudo netstat -tunl**

Result:

> tcp        0      0 0.0.0.0:80              0.0.0.0:*               LISTEN     
> tcp        0      0 127.0.0.1:5300          0.0.0.0:*               LISTEN     
> tcp        0      0 0.0.0.0:53              0.0.0.0:*               LISTEN     
> tcp        0      0 192.168.171.40:443      0.0.0.0:*               LISTEN     
> tcp        0      0 127.0.0.1:4711          0.0.0.0:*               LISTEN     
> udp        0      0 127.0.0.1:5300          0.0.0.0:*                          
> udp        0      0 0.0.0.0:53              0.0.0.0:*                          
> udp        0      0 0.0.0.0:68              0.0.0.0:*                          
> udp        0      0 0.0.0.0:68              0.0.0.0:*    

Not LISTEN :-(

> udp        0      0 127.0.0.1:5300          0.0.0.0:*                  
> udp        0      0 0.0.0.0:53              0.0.0.0:*

I'm running pihole with dnscrypt-proxy.

**My settings**
-dnscrypt-proxy.toml-

> listen_addresses = ['127.0.0.1:5300']
> 
> force_tcp = false
> 
> max_clients = 250
> 
> ipv4_servers = true
> 
> ipv6_servers = false
> 
> dnscrypt_servers = true
> 
> doh_servers = false
> 
> require_dnssec = false
> 
> require_nolog = true
> 
> require_nofilter = true
> 
> timeout = 5000
> 
> keepalive = 30
> 
> blocked_query_response = 'refused'
> 
> lb_strategy = 'random'
> 
> lb_estimator = true
> 
> log_level = 2
> 
> log_file = 'file-to-path'
> 
> cert_refresh_delay = 240
> 
> dnscrypt_ephemeral_keys = true
> 
> tls_disable_session_tickets = true
> 
> tls_cipher_suite = [52392, 49199]
> 
> fallback_resolvers = ['84.200.69.80:53', '84.200.70.40:53']
> 
> ignore_system_dns = true
> 
> netprobe_timeout = -1
> netprobe_address = '84.200.69.80:53'
> 
> block_ipv6 = true
> 
> block_unqualified = true
> 
> block_undelegated = true
> 
> reject_ttl = 600

**iptables settings**
> /sbin/iptables -P INPUT DROP
> /sbin/iptables -P FORWARD DROP
> /sbin/iptables -P OUTPUT ACCEPT
> 
> /sbin/iptables -A INPUT -i lo -j ACCEPT
> /sbin/iptables -A OUTPUT -o lo -j ACCEPT
> 
> /sbin/iptables -A INPUT -m conntrack --ctstate INVALID -j DROP
> /sbin/iptables -A INPUT -m conntrack --ctstate ESTABLISHED -j ACCEPT
> 
> #pi-hole:
> /sbin/iptables -A INPUT -p udp --dport 80 -j REJECT --reject-with icmp-port-unreachable
> /sbin/iptables -A INPUT -p tcp --dport 443 -j REJECT --reject-with tcp-reset
> /sbin/iptables -A INPUT -p udp --dport 443 -j REJECT --reject-with icmp-port-unreachable
> /sbin/iptables -A INPUT -p tcp --dport 4711 -j ACCEPT
> 
> #dnscrypt-proxy:
> /sbin/iptables -A INPUT -s 127.0.0.1 -p tcp -m tcp --dport 5300 -m conntrack --ctstate NEW -j ACCEPT
> /sbin/iptables -A INPUT -s 127.0.0.1 -p udp -m udp --dport 5300 -m conntrack --ctstate NEW -j ACCEPT
> 
> #dns
> /sbin/iptables -A INPUT -i eth0 -p tcp -m tcp --dport 53 -m conntrack --ctstate NEW -j ACCEPT
> /sbin/iptables -A INPUT -i eth0 -p udp -m udp --dport 53 -m conntrack --ctstate NEW -j ACCEPT
> 
> #port 80
> /sbin/iptables -A OUTPUT -o eth0 --src 192.168.171.40 -p tcp -m tcp --dport 80 -m conntrack --ctstate NEW -j ACCEPT
> 
> #port443
> /sbin/iptables -A OUTPUT -o eth0 --src 192.168.171.40 -p tcp -m tcp --dport 443 -m conntrack --ctstate NEW -j ACCEPT
> 
> #block icmp
> /sbin/iptables -A INPUT -i lo -p icmp -j DROP
> /sbin/iptables -A INPUT -i eth0 -p icmp -j DROP

I would be very grateful if you would take some time to help me with my problem with dnscrypt-proxy?

Maybe it's wrong iptables rules or wrong settings in the config file of dnscrypt-proxy?

Best regards!

**Comment by jedisct1** [comment]
What you are seeing in the `tcpdump` output is reverse host names for IP addresses.

This has nothing to do with `dnscrypt-proxy`, and these are not URLs either. It just means that the Internet is working as usual :)

Maybe use a tool such as Wireshark, whose output is easier to understand than `tcpdump`.

**Comment by jedisct1** [comment]
Also, in order to prevent `tcpdump` from resolving IP addresses, you may want to use the `-n` command-line flag.
This is especially recommended when looking at DNS traffic or you may quickly end up with loops (plus, it is slow and generally not useful).
